{
  "schema_version": "leo.integration.v1",
  "message_id": "10000000-0000-4000-8000-000000000001",
  "trace_id": "10000000-0000-4000-8000-000000000002",
  "correlation_id": "10000000-0000-4000-8000-000000000003",
  "causation_id": null,
  "source": "continuum-stub",
  "target": "agent-exchange",
  "kind": "task.requested",
  "created_at": "2026-10-20T00:00:00Z",
  "deadline_at": null,
  "idempotency_key": "synthetic-contract-001",
  "payload": {"provider": "requirements", "payment_mode": "free", "task": {"service": "requirements", "source": "Must: Preserve evidence."}}
}
